{
  "$schema": "https://json-schema.org/draft/2020-12/schema",
  "$id": "https://npdev.local/schemas/ai/custom-panel.schema.json",
  "title": "NPDev AI Custom Panel",
  "type": "object",
  "required": [
    "schemaVersion",
    "panelId",
    "route",
    "dataSources",
    "visibleFields",
    "actions",
    "layout"
  ],
  "properties": {
    "schemaVersion": {
      "const": "ai-custom-panel.v1"
    },
    "panelId": {
      "type": "string",
      "pattern": "^[A-Za-z][A-Za-z0-9-]*$"
    },
    "route": {
      "type": "string",
      "pattern": "^/[A-Za-z0-9/_-]+$"
    },
    "requiredRole": {
      "type": "string",
      "pattern": "^[A-Za-z][A-Za-z0-9-]*$"
    },
    "tenantScoped": {
      "type": "boolean",
      "default": true
    },
    "dataSources": {
      "type": "array",
      "minItems": 1,
      "items": {
        "type": "object",
        "required": [
          "name"
        ],
        "properties": {
          "name": {
            "type": "string",
            "pattern": "^[A-Za-z][A-Za-z0-9-]*$"
          },
          "concept": {
            "type": "string",
            "pattern": "^[A-Z][A-Za-z0-9]*$"
          },
          "procedure": {
            "type": "string",
            "pattern": "^[A-Za-z][A-Za-z0-9-]*$"
          },
          "workflow": {
            "type": "string",
            "pattern": "^[A-Za-z][A-Za-z0-9-]*$"
          }
        },
        "oneOf": [
          {
            "required": [
              "concept"
            ]
          },
          {
            "required": [
              "procedure"
            ]
          },
          {
            "required": [
              "workflow"
            ]
          }
        ],
        "additionalProperties": false
      }
    },
    "visibleFields": {
      "type": "array",
      "items": {
        "type": "string",
        "pattern": "^[A-Za-z][A-Za-z0-9]*$"
      }
    },
    "actions": {
      "type": "array",
      "items": {
        "type": "object",
        "required": [
          "name",
          "binding"
        ],
        "properties": {
          "name": {
            "type": "string",
            "pattern": "^[A-Za-z][A-Za-z0-9-]*$"
          },
          "binding": {
            "enum": [
              "procedure",
              "query",
              "workflow"
            ]
          },
          "procedure": {
            "type": "string",
            "pattern": "^[A-Za-z][A-Za-z0-9-]*$"
          },
          "query": {
            "type": "string",
            "pattern": "^[A-Za-z][A-Za-z0-9]*$"
          },
          "workflow": {
            "type": "string",
            "pattern": "^[A-Za-z][A-Za-z0-9-]*$"
          },
          "requiredRole": {
            "type": "string",
            "pattern": "^[A-Za-z][A-Za-z0-9-]*$"
          },
          "label": {
            "type": "string",
            "minLength": 1,
            "maxLength": 80,
            "pattern": "^[^<>`$]*$"
          }
        },
        "additionalProperties": false
      }
    },
    "layout": {
      "type": "object",
      "required": [
        "type"
      ],
      "properties": {
        "type": {
          "enum": [
            "table",
            "grid",
            "console",
            "dashboard"
          ]
        },
        "fields": {
          "type": "array",
          "items": {
            "type": "string",
            "pattern": "^[A-Za-z][A-Za-z0-9]*$"
          }
        },
        "widgets": {
          "type": "array",
          "description": "Declarative widgets of a console or dashboard layout (tile, chart, actions, history, table). Data only: no code, no component names -- layout.slots, which mount app-owned JavaScript, is deliberately not allowed here.",
          "items": {
            "type": "object",
            "required": [
              "kind"
            ],
            "properties": {
              "kind": { "enum": ["tile", "chart", "actions", "history", "table"] },
              "title": { "type": "string", "minLength": 1, "maxLength": 80, "pattern": "^[^<>`$]*$" },
              "dataSource": { "type": "string", "pattern": "^[A-Za-z][A-Za-z0-9]*$" },
              "aggregate": { "enum": ["count", "sum", "avg", "min", "max"] },
              "field": { "type": "string", "pattern": "^[A-Za-z][A-Za-z0-9]*$" },
              "groupBy": { "type": "string", "pattern": "^[A-Za-z][A-Za-z0-9]*$" },
              "chart": { "enum": ["bar", "line", "donut"] },
              "filter": {
                "type": "object",
                "required": ["field", "equals"],
                "properties": {
                  "field": { "type": "string", "pattern": "^[A-Za-z][A-Za-z0-9]*$" },
                  "equals": { "type": "string", "maxLength": 80, "pattern": "^[^<>`$]*$" }
                },
                "additionalProperties": false
              },
              "span": { "type": "integer", "minimum": 1, "maximum": 4 }
            },
            "additionalProperties": false
          }
        }
      },
      "additionalProperties": false
    },
    "metadata": {
      "type": "object",
      "properties": {
        "displayName": {
          "type": "string",
          "minLength": 1,
          "maxLength": 80,
          "pattern": "^[^<>`$]*$"
        },
        "description": {
          "type": "string",
          "maxLength": 240,
          "pattern": "^[^<>`$]*$"
        },
        "emptyStateMessage": {
          "type": "string",
          "maxLength": 160,
          "pattern": "^[^<>`$]*$"
        },
        "icon": {
          "enum": [
            "table",
            "form",
            "summary",
            "workflow",
            "status"
          ]
        },
        "variant": {
          "enum": [
            "default",
            "compact",
            "readonly"
          ]
        }
      },
      "not": {
        "anyOf": [
          {
            "required": [
              "script"
            ]
          },
          {
            "required": [
              "component"
            ]
          },
          {
            "required": [
              "componentUrl"
            ]
          },
          {
            "required": [
              "dynamicComponent"
            ]
          },
          {
            "required": [
              "externalUrl"
            ]
          },
          {
            "required": [
              "html"
            ]
          }
        ]
      },
      "additionalProperties": false
    },
    "validationHints": {
      "type": "array",
      "items": {
        "type": "string"
      },
      "default": []
    },
    "widgets": {
      "type": "array",
      "items": {
        "type": "object",
        "required": [
          "type"
        ],
        "properties": {
          "type": {
            "enum": [
              "text",
              "integer",
              "date",
              "email",
              "boolean",
              "table",
              "detail-card",
              "form",
              "action",
              "status",
              "workflow-status-badge",
              "procedure-result-block"
            ]
          },
          "field": {
            "type": "string",
            "pattern": "^[A-Za-z][A-Za-z0-9]*$"
          },
          "action": {
            "type": "string",
            "pattern": "^[A-Za-z][A-Za-z0-9-]*$"
          },
          "dataSource": {
            "type": "string",
            "pattern": "^[A-Za-z][A-Za-z0-9-]*$"
          }
        },
        "additionalProperties": false
      },
      "default": []
    },
    "implementation": {
      "$ref": "#/$defs/panelImplementation"
    }
  },
  "not": {
    "anyOf": [
      {
        "required": [
          "script"
        ]
      },
      {
        "required": [
          "customHtml"
        ]
      },
      {
        "required": [
          "externalUrl"
        ]
      },
      {
        "required": [
          "dynamicComponent"
        ]
      },
      {
        "required": [
          "componentUrl"
        ]
      }
    ]
  },
  "additionalProperties": false,
  "$defs": {
    "panelImplementation": {
      "type": "object",
      "required": [
        "mode",
        "language",
        "entrypoint"
      ],
      "properties": {
        "mode": {
          "const": "untrustedExtension"
        },
        "language": {
          "enum": [
            "html+javascript",
            "html",
            "javascript"
          ]
        },
        "entrypoint": {
          "type": "string",
          "pattern": "^[A-Za-z0-9_./-]+\\.(html|js)$",
          "not": {
            "pattern": "(^/|^[A-Za-z]:|\\.\\.)"
          }
        }
      },
      "additionalProperties": false
    }
  }
}
